{
  "protocol": "XLMP/1",
  "xlmpMessageId": "xlmessage:blake3:a4384331a50d850cc0a791a1548aea326b7c6f00c61859f814be0efe133f62e5",
  "jobId": "xljob:blake3:8888888888888888888888888888888888888888888888888888888888888888",
  "researcherId": "xlresearcher:blake3:7777777777777777777777777777777777777777777777777777777777777777",
  "claimId": "xlc:blake3:1117d892ad3a90b5c40d700b96fa1df96882dfc4a52dc23a00ebf1eefc5815f8",
  "proofId": "xlp:blake3:69de74b936da85595bd281d44df98300962f84d818d0c0d44543bf34091c2c96",
  "artifactCommitment": "blake3:5555555555555555555555555555555555555555555555555555555555555555",
  "computeQuoteId": "xlquote:blake3:aaaaaaaaaaaaaaaaaaaaaaaaaaaaaaaaaaaaaaaaaaaaaaaaaaaaaaaaaaaaaaaa",
  "requiredVerificationPolicy": "xlpolicy:blake3:9999999999999999999999999999999999999999999999999999999999999999",
  "modelPolicy": "astra-primary-provider-neutral-v1",
  "rightsManifestHash": "blake3:dddddddddddddddddddddddddddddddddddddddddddddddddddddddddddddddd",
  "revenueRouteHash": "blake3:8888888888888888888888888888888888888888888888888888888888888888",
  "deliveryMode": "encrypted_content_addressed_bundle",
  "validUntil": "2026-09-04T00:00:00Z"
}
